intent,Rid,Request
atis_flight,2806,give me all nonstops from new york to vegas that arrive on a sunday
atis_airfare,2807,i need 2 first class tickets from dallas fort worth to san francisco
atis_flight,2808,what flights from houston to milwaukee on friday in the evening on american airlines
atis_flight,2809,on continental flight 1765 from boston to san francisco what type of meal is served
atis_flight,2810,what are the flights from boston to washington on october fifteenth 1991
atis_flight,2811,give me the one way flights from pittsburgh to boston
atis_flight_time,2812,please give me the flight times the morning on united airlines for september twentieth from philadelphia to san francisco
atis_flight,2813,i'd like to find a flight between dallas and philadelphia
atis_flight,2814,baltimore to philadelphia wednesday
atis_flight,2815,do you have a flight from boston to san francisco with a stopover in fort worth dallas
atis_flight,2816,what are the cheapest one way flights from atlanta to pittsburgh
atis_flight,2817,show nonstop flights from new york to miami on a tuesday which cost less than 466 dollars one way
atis_flight,2818,what flights are available wednesday afternoon from atlanta to san francisco
atis_flight,2819,what flights are available saturday to san francisco from dallas
atis_flight,2820,do any of the continental flights from boston to san francisco stop in denver
atis_flight,2821,i'd like information on flights between philadelphia and san francisco with a stop in dallas
atis_flight,2822,is there a flight from philadelphia to oakland with a stop in dallas
atis_flight,2823,show me all flights from baltimore to philadelphia
atis_flight,2824,show me the flights from boston to san francisco that arrive in the afternoon
atis_flight,2825,what is the cheapest flight from boston to atlanta
atis_flight,2826,what flights from minneapolis to pittsburgh
atis_flight,2827,from new york to toronto on thursday morning
atis_flight,2828,can you tell me the flights that go from boston to atlanta sometime after 5 pm
atis_flight,2829,show all wednesday morning flights from denver to boston
atis_flight,2830,what flights are there from dallas to pittsburgh on monday morning
atis_flight,2831,how about april twenty seventh denver to washington
atis_ground_service,2832,train to newark
atis_flight,2833,show me all nonstop flights between denver and oakland leaving after noon and arriving after 5 pm
atis_flight,2834,i would like to find a flight from charlotte north carolina to las vegas i would like a stopover in st. louis
atis_flight,2835,all the flights from baltimore to san francisco
atis_flight,2836,does continental fly from boston to san francisco with a stop in denver
atis_flight,2837,please give me direct morning flights from pittsburgh to atlanta
atis_flight,2838,show me all flights from san diego to miami with a stop in denver
atis_flight,2839,list all flights that leave from baltimore or denver or pittsburgh and arrive in philadelphia
atis_flight,2840,i would like to fly from boston to san francisco
atis_flight,2841,i would like a nonstop flight from new york to las vegas on march second
atis_airfare,2842,what's the cost of a first class fare from philadelphia to san francisco
atis_flight,2843,what is the last flight from dallas to boston
atis_flight,2844,show me the flights from denver to san francisco
atis_quantity,2845,how many first class flights does united have leaving from all airports today
atis_flight,2846,what are the afternoon flights from denver to san francisco
atis_flight,2847,i want to know what flights you have available coach or economy class from baltimore to dallas
atis_flight_time,2848,please list the flight times from newark to boston
atis_flight,2849,i'm looking for a flight from oakland to denver with a stopover in dallas fort worth
atis_flight,2850,show me all flights from charlotte
atis_flight,2851,show me the evening flights from baltimore to atlanta
atis_flight,2852,are there any flights from boston to san francisco which stop in denver
atis_flight_time,2853,what is the schedule of flights from boston to denver next monday
atis_abbreviation,2854,what does ewr mean
atis_airfare,2855,show me the cheapest fare from baltimore to dallas
atis_flight,2856,show me the nonstop flights from dallas to houston
atis_flight,2857,list the flights from dallas to san francisco on american airlines
atis_flight,2858,show me flights with first class reservations from san francisco to pittsburgh for monday
atis_flight,2859,all flights from boston to washington dc on november eleventh
atis_flight,2860,list lowest cost flight from dallas to baltimore
atis_flight,2861,i would like to fly delta airlines from atlanta to pittsburgh
atis_flight,2862,what are the flights from milwaukee to tampa
atis_flight,2863,find a flight from boston to washington on monday
atis_flight,2864,thank you for that information now i would like information on a flight on april sixteen from atlanta to philadelphia early in the morning
atis_flight,2865,please list the flights from st. paul to kansas city on friday night that serve meals
atis_flight,2866,flight from dallas to boston tomorrow
atis_flight,2867,flights from boston flights from philadelphia to boston on monday
atis_flight,2868,show me all the flights from philadelphia to san francisco
atis_flight,2869,round trip flights between houston and las vegas
atis_flight,2870,which delta flights depart from san francisco heading toward boston after 12 noon
atis_flight,2871,please list all flights from dallas to pittsburgh on july fourth 1991
atis_flight,2872,all right now i need a flight from seattle to san diego
atis_flight,2873,do you have a flight from atlanta to boston that will stop in washington
atis_flight,2874,what flights are available on sunday to pittsburgh from san francisco
atis_flight,2875,is there a flight between washington dc and san francisco on us air at 8 am
atis_flight,2876,philadelphia to san francisco monday
atis_flight_time,2877,what's the schedule of flights from atlanta to boston on august first
atis_flight,2878,show me the flights on delta to atlanta in the morning
atis_flight,2879,what is the next flight from pittsburgh to san francisco after delta flight 1059
atis_flight,2880,i need a flight on friday from newark to tampa
atis_flight,2881,what are the flights and prices from la to charlotte for monday morning
atis_flight,2882,does midwest express serve nashville
atis_airfare,2883,show me all prices of economy from baltimore to dallas
atis_flight,2884,i need a flight from phoenix to detroit leaving monday evening
atis_flight,2885,flight from ontario to orlando that departs 9 hours before arriving
atis_flight,2886,now show me the flights from denver to atlanta
atis_flight,2887,i need to make a trip starting in boston going to dallas denver oakland and back to boston
atis_abbreviation,2888,what does ewr mean
atis_flight,2889,display all flights from toronto to san diego on us air with a layover in phoenix
atis_quantity,2890,how many airports does oakland have
atis_airline,2891,show me the airlines that fly between toronto and denver
atis_flight,2892,what are the cheapest round trip flights from denver to atlanta
atis_flight,2893,i would like the cheapest flight from boston to san francisco
atis_flight,2894,i want wednesday flights from atlanta to washington dc
atis_flight,2895,sure i want to go from philadelphia to dallas
atis_flight,2896,find travel arrangements for a round trip flight from boston to pittsburgh
atis_flight,2897,please list the flights from chicago to kansas city
atis_flight,2898,list all flights from seattle on continental which depart after 430 pm
atis_flight,2899,list all flights arriving and departing at general mitchell international
atis_flight,2900,i want a nonstop flight from indianapolis to toronto that leaves thursday morning
atis_flight,2901,list all united flights from boston to san francisco
atis_flight,2902,i'd like to go from boston to pittsburgh to find the cheapest flight
atis_flight,2903,i'd like to fly late tomorrow from minneapolis to long beach
atis_flight,2904,newark to minneapolis on sunday
atis_flight,2905,i want a flight from toronto to san diego that stops in st. louis are there flights
atis_flight,2906,what flights does american airlines have from boston to dallas
atis_flight,2907,find me the flights that are nonstop between boston and dallas that leave between 12 and 2 in the afternoon
atis_flight,2908,show me the flights from san francisco to pittsburgh on tuesday
atis_ground_service,2909,what ground transportation is available in dallas tomorrow
atis_flight,2910,i would like the first flight from dallas into houston on march first and the last flight from houston back to dallas on march first
atis_airfare,2911,what is the lowest price fare from atlanta to san francisco on flight delta 82 and delta 139
atis_flight,2912,what are the classes of service on delta airlines
atis_flight,2913,information on flights from boston to washington
atis_flight,2914,first class from detroit to st. petersburg
atis_flight,2915,locate flights from philadelphia to dallas stopping in hartfield
atis_airfare,2916,hi i want a round trip ticket to dallas
atis_airfare,2917,show me fares from baltimore to philadelphia
atis_flight,2918,is the american flight 813 from boston to oakland a nonstop flight
atis_flight,2919,shortest evening flight from tampa to cincinnati
atis_flight,2920,show all flights philadelphia to dallas
atis_airfare,2921,what is the fare from boston to oakland on united airlines
atis_flight,2922,i'd like information on boston to washington
atis_ground_service,2923,what ground transportation is available at denver airport
atis_flight,2924,i want to find the first flight from baltimore to boston that serves a meal
atis_flight,2925,are there wednesday morning flights between pittsburgh and boston
atis_flight,2926,show me the flights from san diego to newark new jersey
atis_flight,2927,can you show me evening flights from nashville to houston that serve dinner
atis_flight,2928,show me the monday flights from san francisco to pittsburgh
atis_airfare,2929,list all round trip fares from st. petersburg to washington
atis_flight,2930,what are all flights from philadelphia to denver on wednesdays
atis_flight,2931,what are the flights from dallas to baltimore
atis_flight,2932,give me the continental flights from chicago to seattle on saturday morning
atis_flight,2933,show me the cheapest round trips from dallas to baltimore
atis_flight,2934,can you list all flights between milwaukee and chicago
atis_flight,2935,united airlines stopping in denver
atis_flight,2936,list flights from pittsburgh to san francisco
atis_flight,2937,what flights leave la guardia for san jose and arrive 10 pm
atis_flight_time,2938,i want to know the time of the latest flight i can take from washington to san francisco where i can get a dinner meal
atis_flight,2939,what flights are available from denver to san francisco
atis_flight,2940,yes i'd like a flight from long beach to st. louis by way of dallas
atis_flight,2941,give me flights from san francisco to boston on thursday afternoon
atis_airfare,2942,fares from dallas to baltimore
atis_abbreviation,2943,what does restriction ap 57
atis_flight,2944,show me all the flights from cincinnati to toronto
atis_flight,2945,what flights are there on continental from seattle to chicago
atis_flight,2946,show me the round trip flights between phoenix and salt lake city
atis_flight,2947,give me the flights with the fares on december twenty seventh from indianapolis to orlando
atis_ground_service,2948,what ground transportation is available at the boston airport
atis_flight,2949,what are the flights from kansas city to burbank on saturday may twenty two on southwest
atis_flight,2950,give me the cheapest round trip flight from dallas to baltimore
atis_airline,2951,which airline can fly me from atlanta to denver to san francisco
atis_airfare,2952,what is the cheapest round trip fare between boston and san francisco
atis_flight,2953,i'd like a list of the flights from oakland to dallas fort worth on sunday
atis_flight,2954,i want to fly from baltimore to philadelphia
atis_flight,2955,i'd like the first flight in the morning from boston to washington
atis_flight,2956,flights from denver to philadelphia include fares
atis_flight,2957,afternoon flight from denver to san francisco
atis_flight,2958,i would like a flight from philadelphia to dallas
atis_airfare,2959,what are the fares between new york and la on monday morning
atis_flight,2960,show me the flights from montreal to philly
atis_flight,2961,show me the flights out of love field
atis_flight,2962,what are all the flights between san francisco and boston
atis_flight,2963,i need an early flight from denver to san francisco please and i would like breakfast served on that
atis_flight,2964,show me the flights from st. petersburg to toronto that arrive early in the morning
atis_flight,2965,could you please tell me the first flight leaving baltimore to san francisco on a 747 on august twenty seventh
atis_flight,2966,i would like a flight from washington to boston flight 324 on august twentieth
atis_flight,2967,all flights from charlotte to anywhere on us air
atis_airfare,2968,what is the least expensive fare from baltimore to san francisco leaving on september thirtieth
atis_flight,2969,flight will start from boston
atis_flight,2970,what is the first flight from boston to san francisco on saturday
atis_flight,2971,pittsburgh to atlanta wednesday
atis_flight,2972,show me flights from milwaukee to orlando on wednesday night
atis_flight,2973,show me the flights leaving from love field
atis_flight,2974,show first flight from pittsburgh to atlanta on wednesday
atis_airfare,2975,what's the price of the least expensive first class round trip ticket on us air from cleveland to miami
atis_flight,2976,what morning flights do you have between oakland and denver
atis_flight,2977,is there a flight between san francisco and boston with a stopover in dallas fort worth
atis_flight,2978,list the morning flights at a 124 dollars from atlanta to boston
atis_flight,2979,what flights are there from new york city to las vegas
atis_flight,2980,what flights leave from phoenix to nashville on american airlines
atis_flight,2981,show me the flights from atlanta to boston
atis_flight,2982,what flights go from atlanta to washington dc on thursday
atis_flight,2983,i live in washington and i would like to make a trip to san francisco can you tell me which airlines connect with those two cities
atis_flight,2984,i would like to fly us air from orlando to cleveland in the late evening what do you have available
atis_flight,2985,please list the flights from new york to miami on a tuesday
atis_flight,2986,i am interested in a flight on american airlines from dallas to washington
atis_flight,2987,i am interested in booking an early morning flight from dallas into houston and returning in the late evening
atis_flight,2988,i want an early morning flight from boston to philadelphia
atis_flight,2989,what flights are there from boston to denver on monday morning
atis_airfare,2990,please show me the cost of flight ua 201 from boston to denver and flight ua 343 from boston to denver
atis_flight,2991,show me the most expensive one way flight from detroit to westchester county
atis_flight,2992,show me which flights from san francisco to pittsburgh on a monday are first class
atis_airfare,2993,list a round trip fare from kansas city to minneapolis flights
atis_flight,2994,please give me the earliest flight tomorrow from st. petersburg to milwaukee
atis_ground_service,2995,what ground transportation is available in san francisco
atis_aircraft,2996,leaving denver flying to san francisco before 10 am what type of aircraft is used
atis_flight,2997,flights from nashville to seattle
atis_flight,2998,show me all flights from san francisco to pittsburgh on friday
atis_flight,2999,show me all flights from pittsburgh to atlanta
atis_flight,3000,i want an early morning flight between philadelphia and pittsburgh on tuesday morning
atis_flight,3001,what is the most expensive flight from boston to dallas round trip
atis_flight,3002,what is the latest flight leaving pittsburgh returning to denver
atis_flight,3003,please give me the united airlines flights from denver to baltimore that are the first class flights please
atis_flight,3004,i need flights that arrive in baltimore from pittsburgh
atis_flight,3005,show me the flights to love field
atis_flight,3006,show me all flights from san diego to new york using dc10
atis_ground_service,3007,ground transportation in baltimore
atis_flight,3008,what flights are there from atlanta to baltimore
atis_flight,3009,does continental fly from denver to san francisco
atis_airline,3010,list all the airlines that fly into general mitchell international
atis_flight,3011,give me all the flights from new york to miami round trip
atis_flight,3012,show me all flights from atlanta to san francisco which leave the day after tomorrow after 5 o'clock pm
atis_abbreviation,3013,what does ea mean
atis_flight,3014,show first flight from boston to philadelphia
atis_flight,3015,could you list for me the flights that leave oakland on sunday and arrive in dallas
atis_flight,3016,am flights from atlanta to philadelphia
atis_airfare,3017,show me all prices of first class from baltimore to dallas
atis_flight,3018,i would like a flight from philadelphia to san francisco but i would like to stop in dallas
atis_flight,3019,show me the flights on delta or twa which go through atlanta
atis_flight,3020,what is the cheapest flight from denver to pittsburgh on july twenty sixth
atis_flight,3021,show me flights from dallas to houston and from houston to dallas
atis_airfare,3022,what are the cost of morning flights from atlanta to baltimore
atis_flight,3023,find the cheapest flight from denver to atlanta with a stopover in pittsburgh
atis_flight,3024,show me the direct flights from san francisco to boston
atis_flight,3025,please list the friday night flights from st. paul to kansas city
atis_flight,3026,i would like some information on the earliest flights you have leaving atlanta arriving in denver
atis_flight,3027,what flights are there from baltimore to san francisco
atis_flight,3028,what flights go from boston to pittsburgh after 1205 in the afternoon
atis_flight,3029,show me flights from dallas to pittsburgh
atis_flight,3030,can you list all flights from chicago to milwaukee
atis_airline,3031,is there an airline that advertises having more flights than any other airline
atis_flight,3032,what is the earliest flight that goes from atlanta to washington on thursday
atis_flight,3033,hi i'm calling from boston i'd like to make a flight to either orlando or los angeles
atis_flight,3034,i would like to fly from boston to philadelphia next thursday
atis_flight,3035,what is the cheapest flight from pittsburgh to atlanta leaving on october fifth
atis_flight,3036,what flights are available from pittsburgh to oakland airport
atis_airfare,3037,i want a round trip fare from new york to san jose
atis_airfare,3038,what are the coach fares from la to charlotte monday morning
atis_flight,3039,are there any flights after 9 pm from san francisco to washington
atis_flight,3040,i'm looking for a flight that goes from san jose to houston on may thirtieth and that leaves after noon
atis_flight,3041,are there any flights next monday morning from pittsburgh to san francisco
atis_flight,3042,what flights do you have from ontario
atis_flight,3043,do you have a twa flight leaving early in the morning to san francisco from denver
atis_flight,3044,show me the flights on twa from atlanta in the morning
atis_flight,3045,i would like some information on a flight from denver to san francisco on united airlines
atis_flight,3046,what are the delta flights from dallas to boston
atis_flight,3047,all flights from sfo to long beach
atis_flight,3048,what flights are available from san francisco to pittsburgh on thursday evening
atis_flight,3049,what are your flights from denver to baltimore
atis_flight,3050,flights from westchester county to san francisco daily
atis_flight,3051,i want to leave before 8 in the morning what flight should i take to atlanta from boston
atis_flight,3052,give me the flights for american airline from philadelphia to dallas
atis_ground_service,3053,is there ground transportation in boston from the airport
atis_flight,3054,i would like a flight leaving from washington to boston at 110 pm on august twentieth
atis_flight,3055,show me flights from los angeles to pittsburgh on monday evening
atis_flight,3056,what flights from detroit to st. petersburg
atis_flight,3057,what is the earliest flight you have that leaves philadelphia to dallas
atis_ground_service,3058,please give me ground transportation information for denver
atis_airfare,3059,okay could you get me a round trip ticket from indianapolis to kansas city
atis_flight,3060,show me a list of flights from pittsburgh to baltimore on august third
atis_flight,3061,show me flights from atlanta to washington dc leaving on thursday
atis_abbreviation,3062,what does fare code qo mean
atis_flight,3063,what flights are there from atlanta to oakland on thursday with in flight meals
atis_flight,3064,i would like to find the least expensive flight from boston to denver
atis_flight,3065,what delta flights fly from washington to dallas in the morning
atis_abbreviation,3066,what is ewr
atis_flight,3067,please list any flights from oakland california to philadelphia on tuesday
atis_flight,3068,what is the earliest flight i can get from baltimore to boston
atis_flight,3069,what does flight code us mean
atis_flight,3070,list nonstop flights from burbank to denver arriving by 6 pm
atis_flight,3071,the most expensive flight between boston and philadelphia
atis_flight,3072,give me the flights from indianapolis to orlando on december twenty seventh and twenty eighth
atis_flight,3073,flights from pittsburgh to los angeles thursday evening
atis_flight,3074,show flights from san francisco to denver on either wednesday the twenty third or thursday the twenty fourth
atis_flight,3075,i need a connecting flight on continental on june fifth from chicago to seattle
atis_flight,3076,i would like an afternoon flight leaving tuesday san diego to indianapolis
atis_flight,3077,what nonstop flights are available from oakland to philadelphia arriving between 5 and 6 pm
atis_flight,3078,we're going from denver to san francisco
atis_flight,3079,on monday i'd like to travel from las vegas to detroit michigan
atis_flight,3080,please list the morning flights from st. louis to st. paul
atis_flight,3081,what flights from baltimore to san francisco arrive before 8 pm in san francisco
atis_ground_service,3082,show me the car rentals in baltimore
atis_airline,3083,what airlines fly from boston to atlanta
atis_flight,3084,what flights are available from pittsburgh to boston on saturday
atis_flight,3085,what flights from kansas city to chicago leave next wednesday returning the following day
atis_flight,3086,i'd like to fly from philadelphia to dallas through atlanta
atis_flight,3087,show me all flights that depart from san francisco and go to either boston philadelphia or baltimore
atis_flight,3088,show me flights on monday from philadelphia to boston after 7 am
atis_flight,3089,from phoenix to denver on a monday
atis_flight,3090,show me the flights on american airlines from fort worth to denver on the evening of july eleventh
atis_flight,3091,show me the itinerary for the connecting flight from dallas fort worth to san francisco that departs dallas fort worth at 1940
atis_ground_service,3092,show me ground transportation in denver
atis_airfare,3093,i would like your rates between atlanta and boston on september third
atis_airline,3094,show me airlines going from pittsburgh going to denver and then continuing to san francisco on monday
atis_flight,3095,show me all round trip flights between houston and las vegas
atis_flight,3096,is there an american airlines flight in the evening from dallas to san francisco
atis_airfare,3097,okay i just want to know the cheapest fare from atlanta to boston
atis_flight,3098,show me the flights from baltimore to atlanta
atis_flight,3099,what is the earliest flight you have leaving boston heading to philadelphia
atis_flight,3100,show me the flights from oakland to denver
atis_flight,3101,what are the flights from st. louis to burbank sunday evening
atis_airline,3102,could you please tell me the airlines that fly from toronto to san diego
atis_flight,3103,show me the qx fare flights between atlanta and oakland on delta airlines
atis_flight,3104,all flights to baltimore after 12 pm
atis_flight,3105,what flights are there from phoenix to milwaukee
atis_flight,3106,i want to travel from kansas city to chicago round trip leaving wednesday june sixteenth arriving in chicago at around 7 o'clock in the evening and returning the next day arriving in kansas city at around 7 o'clock in the evening which airlines fly that route
atis_ground_service,3107,is there a limousine service available from the pittsburgh airport
atis_flight,3108,show me flights from seattle to san francisco that leave after 5 pm
atis_airfare,3109,can you show me what fares are available from oakland to dallas on december sixteenth one way only
atis_flight,3110,show me all flights from charlotte to philadelphia
atis_flight,3111,all flights from boston to washington dc after 5 pm on november eleventh economy class
atis_flight,3112,i would like information on flights from san francisco to pittsburgh leaving after 8 pm monday night
