intent,Rid,Request
atis_airfare,1864,please give me round trip fares from pittsburgh to philadelphia
atis_flight,1865,saturday flights from las vegas to phoenix
atis_flight,1866,list the earliest flight from st. paul to san jose
atis_ground_service,1867,show me the ground transportation to westchester county
atis_airfare,1868,first class price san francisco pittsburgh round trip
atis_flight,1869,i like to see the information for flights from pittsburgh to san francisco leaving pittsburgh after 12 pm
atis_airfare,1870,what are the prices of the flights from dallas to baltimore
atis_flight,1871,flight from denver to boston
atis_flight,1872,what is the latest afternoon flight departing san francisco and arriving in boston on november ninth
atis_flight,1873,show me the flights from san diego to newark
atis_airline,1874,what airlines fly from boston to pittsburgh
atis_flight,1875,what flights are there on wednesday evening or thursday morning from denver to sfo
atis_flight,1876,show me the flights from pittsburgh to san francisco for thursday night or friday
atis_airfare,1877,show me the airfare from pittsburgh to san francisco
atis_flight,1878,show me all flights from atlanta to dallas round trip less than 1100 dollars
atis_flight,1879,all flights from san francisco to boston leaving before noon
atis_ground_service,1880,how do i get downtown from the toronto airport
atis_flight,1881,show me all flights from pittsburgh to oakland that arrive after 10 am
atis_airfare,1882,what are the coach class fares on flights from pittsburgh to atlanta
atis_flight,1883,i need to go from boston to dallas
atis_flight,1884,i'd like to find a us air flight from orlando to cleveland that arrives around 10 o'clock in the evening
atis_flight,1885,i want to go from denver to atlanta round trip and make a stop at pittsburgh is this possible
atis_flight,1886,when is the earliest flight from boston to denver
atis_flight,1887,i'd like a flight on american from newark to nashville
atis_flight,1888,please list for me the flights on united airlines between boston and denver
atis_flight,1889,flights from phoenix to milwaukee
atis_flight,1890,show me the flights from san diego to newark
atis_flight,1891,i would like to fly from salt lake city back to st. petersburg on wednesday
atis_flight,1892,show me the flights from indianapolis to orlando with round trip fares less than 1288
atis_flight,1893,show me the flights from boston to san francisco
atis_flight,1894,please list the twa flights from las vegas to new york and fare
atis_flight,1895,i want a flight between oakland and boston that arrives before 5 pm
atis_flight,1896,what flights are there from nashville to houston tomorrow evening that serve dinner
atis_flight,1897,list the flights arriving in boston from atlanta on august fifth
atis_flight,1898,what are the flights from atlanta to baltimore which arrive in baltimore at 7 o'clock pm
atis_flight,1899,what is the cheapest flight from denver to oakland
atis_flight,1900,show me the flights from pittsburgh to baltimore arriving in baltimore on june fourteenth
atis_flight,1901,i want information on flights from atlanta to washington dc i want to leave after 4 pm on wednesday or before 9 am on thursday
atis_flight,1902,does delta airline fly from denver to pittsburgh
atis_flight,1903,what are the flights from denver to baltimore on united airlines
atis_flight,1904,what are the flights for united airlines on september twentieth in the morning
atis_flight,1905,please list all flights between boston and san francisco nonstop
atis_flight,1906,sunday flights from new york city to las vegas
atis_abbreviation,1907,what does fare code qo mean
atis_flight,1908,please show me all the flights from denver to oakland that are nonstop
atis_flight,1909,eastern flight 825 from atlanta to denver leaving at 555 what type of aircraft is used on that flight
atis_airfare,1910,what's the cheapest fare for a round trip from indianapolis to orlando on december twenty seventh
atis_flight,1911,what flights are available friday afternoon from atlanta to dallas
atis_flight,1912,all do you have a flight from washington to boston that stops in philadelphia
atis_airfare,1913,how much does the american airlines flight 71 from dallas to san francisco cost
atis_airfare,1914,all fares and flights from philadelphia
atis_flight,1915,what flight do you have from atlanta to dallas on august twenty seventh in the morning
atis_airfare,1916,i'd like the cheapest one way fare from boston to atlanta please
atis_flight,1917,are there any direct flights from atlanta to philadelphia arriving in philadelphia about 12 noon
atis_airline,1918,show all airlines with flights between denver and dallas
atis_flight,1919,show me all flights from san diego to los angeles
atis_flight,1920,flights from san francisco august one
atis_flight,1921,show me flights on sunday going from san francisco to boston nonstop first class leaving after 12 noon
atis_flight,1922,list flights from atlanta to boston on wednesday afternoon
atis_flight,1923,show me the least expensive flight from miami to cleveland on sunday after noon
atis_flight,1924,please show me the flights from denver to baltimore between 10 am and 2 pm
atis_flight,1925,show flights from baltimore to san francisco between 6 pm and 8 pm on friday
atis_flight,1926,show me the cheapest flights from san francisco to boston
atis_aircraft,1927,what planes are used by twa
atis_flight,1928,all flights from dallas to san francisco
atis_flight,1929,flight information on january twenty third 1992 from denver to san francisco
atis_abbreviation,1930,what is the abbreviation d10
atis_flight,1931,show me all flights from denver to burbank
atis_ground_service,1932,what ground transportation is there in atlanta
atis_flight,1933,flights from baltimore to philadelphia where the round trip fare is less than 1000 dollars
atis_flight,1934,show me the cheapest one way flights from dallas to san francisco leaving dallas after 4 pm
atis_flight,1935,tell me about flights from charlotte to atlanta next tuesday
atis_flight,1936,show me the flights on delta that go through atlanta
atis_flight,1937,okay i'm looking for a flight from tampa to st. louis leaving before 10 am any day
atis_flight,1938,what is the earliest morning flight from san francisco to boston
atis_flight,1939,what are the flights available after 6 pm between san francisco and boston
atis_airfare,1940,what is the cost for a one way trip from pittsburgh to atlanta
atis_flight,1941,from denver to washington dc on monday november eleventh 1991
atis_flight,1942,what is the earliest flight from washington to san francisco
atis_flight,1943,give me flights from chicago to seattle on saturday morning
atis_flight,1944,what are all flights from boston to denver
atis_flight,1945,okay how about a flight on sunday from tampa to charlotte
atis_airfare,1946,what is the cheapest one way fare from any city to another
atis_flight,1947,looking for a flight from cleveland to dallas
atis_flight,1948,list the takeoffs and landings at general mitchell international
atis_flight,1949,information on round trip flights from pittsburgh to san francisco first class
atis_flight,1950,i would like to see the flights from denver to philadelphia
atis_flight,1951,show me the available flights from san francisco to boston on november twenty fourth
atis_flight,1952,i need a list of late afternoon flights from chicago to milwaukee
atis_flight,1953,i would like to fly from denver to boston on wednesday the twenty first
atis_flight,1954,i need to make reservations from denver to boston
atis_flight,1955,i'd like a return flight from denver to atlanta evening flights
atis_flight,1956,i want to find a flight from boston to atlanta
atis_flight,1957,flights from pittsburgh to baltimore between 10 am and 2 pm
atis_flight,1958,give me information on flights from atlanta to washington dc on wednesday after 4 pm and thursday before 9 am
atis_flight,1959,could i have listings of flights from new york to montreal canada leaving on wednesday
atis_flight,1960,show me all flights from new york to miami leaving on a tuesday and returning on sunday
atis_airfare,1961,find the cheapest one way fare from pittsburgh to san francisco
atis_flight,1962,what flights are there from boston to dallas
atis_ground_service,1963,tell me about ground transportation at toronto
atis_flight,1964,i would like an early morning flight from chicago into seattle on continental airlines
atis_flight,1965,i need information on a flight from washington to fort worth
atis_flight,1966,what are all the flights into atlanta's airport
atis_flight,1967,show me the cheapest flight on june fourteenth arriving in baltimore starting from dallas
atis_flight,1968,first i'd like to fly from philadelphia to dallas and fly from dallas to san francisco
atis_airfare,1969,i'd like to buy a coach class ticket from denver to atlanta with a stopover in pittsburgh
atis_flight,1970,display all flights from pittsburgh to san francisco on august second
atis_flight,1971,list round trip flights from orlando to kansas city
atis_flight,1972,what flights does american airlines fly from philadelphia to dallas
atis_flight,1973,i would like to fly from baltimore to san francisco on eastern airlines
atis_flight_time,1974,please list the flight times from newark to boston
atis_flight,1975,show me the nonstop flights from dallas to houston
atis_flight,1976,are there any nonstop flights leaving from denver arriving in baltimore on july seventh
atis_ground_service,1977,i need ground transportation in seattle
atis_flight,1978,show me all flights from pittsburgh to baltimore on thursday
atis_flight,1979,i need a flight from new york to montreal thursday may six arriving before noon
atis_flight,1980,can you show me the available flights from baltimore to dallas with economy fares
atis_airfare,1981,how much is an economy ticket from washington to san francisco on september thirtieth
atis_flight,1982,now i'd like flights from philadelphia to pittsburgh leaving between 430 and 530 pm
atis_flight,1983,atlanta to oakland thursday
atis_flight,1984,what is the cheapest flight from denver to pittsburgh leaving on september twenty eighth
atis_flight,1985,show me the flights from denver that go to pittsburgh and then atlanta
atis_flight,1986,what are the united airlines flights between baltimore and denver on august twelfth
atis_ground_service,1987,describe ground transportation in dallas
atis_flight,1988,does american airlines fly from pittsburgh to atlanta
atis_flight,1989,from las vegas to new york a nonstop twa and fare
atis_airfare,1990,can you list the cheapest round trip fare from orlando to kansas city
atis_flight,1991,show flights from philadelphia to dallas on saturday
atis_flight,1992,yes i need a flight from denver to pittsburgh on july seventh
atis_flight,1993,information on american airlines from washington to fort worth
atis_flight,1994,what flights from houston to milwaukee on friday on american airlines
atis_airfare,1995,cheapest round trip airfare from tacoma to orlando
atis_flight,1996,what is the last flight from atlanta to boston
atis_flight,1997,american flight 4400 from cincinnati to houston
atis_flight,1998,show me round trips from houston to las vegas nonstop
atis_flight,1999,i would like to fly from pittsburgh to atlanta on us air at the latest time possible in the evening
atis_flight,2000,show all united flights between boston and philadelphia
atis_flight,2001,is there a flight from baltimore to san francisco with a stop in denver on twa
atis_flight,2002,pittsburgh to boston saturday
atis_flight,2003,please show flights arriving in philadelphia from denver
atis_flight,2004,i want to fly from boston to san francisco
atis_flight,2005,list daily flights of united airline from denver to baltimore with first class service
atis_flight,2006,i want to fly boston to san francisco
atis_flight,2007,pittsburgh to atlanta please with a stopover in fort worth
atis_flight,2008,can you show me flights that are economy class from baltimore to dallas
atis_airfare,2009,i'd like information on the least expensive airfare round trip from pittsburgh to boston
atis_flight,2010,show me the flights from san francisco to dallas on continental airlines
atis_abbreviation,2011,explain restriction ap please
atis_flight,2012,give me flights from pittsburgh to baltimore
atis_flight,2013,i need information on flights leaving philadelphia on friday arriving in oakland california
atis_flight,2014,i need a flight from san francisco to boston that leaves after 7 am
atis_flight,2015,show me all flights from boston to dallas fort worth both direct and connecting that arrive before noon
atis_flight,2016,list all flights from baltimore to san francisco on friday
atis_flight,2017,i need a flight after 6 pm on wednesday from oakland to salt lake city
atis_flight,2018,information on american airlines from fort worth texas to philadelphia
atis_flight,2019,show me flights from baltimore to philadelphia
atis_flight,2020,i would like information on flights from oakland california to dallas leaving on sunday morning
atis_flight,2021,i want to go from baltimore to san francisco with a stopover in denver
atis_flight,2022,what is the latest first class flight of the day leaving dallas for san francisco
atis_flight,2023,nonstop flights seattle to kansas city
atis_abbreviation,2024,what is fare code h
atis_airfare,2025,i am looking for the cheapest fare from indianapolis to orlando on december twenty seventh
atis_flight,2026,show flights from dallas to oakland
atis_airline,2027,what kind of airline is flight ua 281 from boston to denver
atis_flight,2028,i need information for a flight from denver to atlanta
atis_flight_time,2029,please list the flight times from pittsburgh to newark
atis_flight,2030,display all flights from san francisco to boston on august eighth
atis_airfare,2031,i'm interested in the cheapest fare from washington to fort worth
atis_flight,2032,flight leaving chicago to nashville
atis_airfare,2033,what are the fares for flights between atlanta and dfw provided by american airlines
atis_flight,2034,i would like information for flights from baltimore to dallas on early tuesday morning
atis_flight,2035,i'd like a flight from baltimore to boston as early in the morning as i can
atis_flight,2036,find the earliest flight from boston to san francisco that serves a meal
atis_flight,2037,show me all flights from charlotte to columbus
atis_airline,2038,which airlines fly from bwi to dallas fort worth
atis_flight,2039,what flights do you have from burbank to tacoma washington
atis_airfare,2040,what is the lowest fare from denver to pittsburgh
atis_flight,2041,on tuesday i'd like to fly from detroit to st. petersburg
atis_flight,2042,philadelphia to boston saturday
atis_flight,2043,what is your earliest flight from boston to washington on august twenty seventh
atis_flight,2044,show me the flights on delta from atlanta in the morning
atis_flight,2045,i'd like to have flight from denver to pittsburgh
atis_flight,2046,i'd like to book a flight from san diego to toronto
atis_ground_service,2047,tell me about ground transportation between orlando international and orlando
atis_flight,2048,what flights are available friday afternoon from philadelphia to oakland california
atis_flight,2049,i would like the earliest morning flight from atlanta to philadelphia on wednesday morning
atis_flight,2050,i need the earliest flight from denver to boston that serves dinner
atis_flight,2051,of the flights available from dallas to baltimore on august third which airline has the least expensive flight
atis_flight,2052,list flights from dallas to san francisco
atis_flight,2053,please give all flights from dallas to oakland california monday
atis_flight,2054,and flights leaving from atlanta to oakland leaving after 5 pm
atis_flight,2055,what flights are there from denver to atlanta
atis_flight,2056,show me early friday morning flights from san francisco to boston
atis_flight,2057,all flights from pittsburgh to philadelphia next tuesday arriving near 6 o'clock
atis_airfare,2058,okay we're going from washington to denver first class ticket i'd like to know the cost of a first class ticket
atis_flight,2059,give me the flights from san francisco to washington dc for december first
atis_flight,2060,show me the flights from san diego to newark
atis_flight,2061,what are your flights from dallas to baltimore
atis_flight,2062,list daily flights from denver to boston
atis_flight,2063,what flights are there on wednesday evening from denver to sfo
atis_flight,2064,show me the flights on tuesday morning from charlotte to baltimore
atis_flight,2065,sfo to denver on monday november eleventh 1991
atis_flight,2066,okay i'd like to fly from denver to pittsburgh
atis_aircraft,2067,what type of aircraft flies from pittsburgh to baltimore
atis_flight,2068,flights from newark to cleveland daily 5 o'clock pm
atis_flight,2069,what flights arrive in seattle from on continental
atis_flight,2070,please list the flights from phoenix to san diego
atis_flight,2071,does eastern airlines fly between boston and washington
atis_airfare,2072,round trip fares from denver to philadelphia under 1000 dollars
atis_ground_service,2073,show me all ground transportation in washington dc
atis_flight,2074,round trip houston to las vegas nonstop
atis_ground_service,2075,how do i get to philadelphia downtown from the airport
atis_flight,2076,all flights from baltimore to atlanta between 1 o'clock and 3 o'clock in the afternoon
atis_abbreviation,2077,what is restriction ap 57
atis_airfare,2078,how much will it cost taking coach from orlando to indianapolis on december twenty ninth flying us air 311
atis_flight,2079,what are the flights from milwaukee to orlando on wednesday
atis_airfare,2080,fares and flights from pittsburgh to philadelphia
atis_airfare,2081,what is the round trip fare on continental 1291 from dallas to san francisco and return
atis_flight,2082,are there any thrift economy flights to san francisco from boston
atis_airfare,2083,give me the round trip coach fare from dallas to baltimore
atis_flight_time,2084,what are the times that you have planes leaving from san francisco going to pittsburgh on july seventh
atis_ground_service,2085,i need information for ground transportation denver colorado
atis_flight,2086,okay what i would like to know is does twa flight 505 from charlotte to las vegas with a stop in st. louis serve dinner that's twa flight 505 or 163
atis_flight,2087,can you give me a list of the flights from atlanta to boston
atis_flight_time,2088,what time are the flights from baltimore to san francisco
atis_flight,2089,what economy flights are available from dallas to baltimore on july twenty fifth 1991
atis_flight,2090,flight 417 from cincinnati to dallas
atis_flight,2091,flights from montreal and phoenix to las vegas
atis_ground_service,2092,ground transportation dallas
atis_flight,2093,what are the flights from dallas to boston for tomorrow night or evening
atis_flight,2094,which transcontinental flight on united airlines from boston to dallas makes a stopover in philadelphia
atis_airline,2095,airline that stands for dl
atis_flight,2096,show me flights from new york to miami
atis_flight,2097,what flights leave after 7 pm from philadelphia to boston
atis_flight,2098,list all the flights from charlotte to atlanta that return around 7 pm
atis_flight,2099,could you tell me the flights leaving pittsburgh around midnight for oakland
atis_flight,2100,i want to leave oakland and arrive in boston at 5 o'clock in the afternoon
atis_aircraft,2101,i want to go and take a plane in atlanta and fly to boston
atis_ground_service,2102,show me the ground transportation schedule in san francisco on thursday evening
atis_flight,2103,show me all flights from pittsburgh to baltimore tomorrow
atis_abbreviation,2104,what does fare code qx mean
atis_flight,2105,show me the nonstop flights from nashville to st. louis
atis_flight,2106,show me flights from san francisco to denver on weekdays
atis_flight,2107,i want a flight on twa from boston to denver
atis_flight,2108,i live in denver and i'd like to make a trip to pittsburgh
atis_flight,2109,i'm interested in a flight from dallas to washington and i'm also interested in going to baltimore
atis_airfare,2110,show me the cheapest one way tickets from atlanta to dallas
atis_abbreviation,2111,what does the fare code y mean
atis_flight,2112,show me the earliest flight from cleveland to memphis
atis_flight,2113,give me flights from pittsburgh to baltimore
atis_abbreviation,2114,explain the restriction ap 80
atis_flight,2115,what flights leave pittsburgh and arrive in los angeles after 5 pm on thursday
atis_flight,2116,list the flights between san jose and houston
atis_ground_service,2117,what ground transportation is available at the atlanta airport
atis_flight,2118,what are the flights from san francisco to washington dc
atis_flight,2119,i would like a nonstop flight from memphis to las vegas on march second
atis_flight,2120,i would like a us air flight from toronto to san diego with a stopover in denver please
atis_ground_service,2121,ground transportation washington
atis_flight,2122,on november twenty third what flights are available between boston and denver on american airlines
atis_flight,2123,list daily flights from oakland to boston using twa
atis_airfare,2124,show me round trip fares between san francisco and washington dc
atis_flight,2125,is there a round trip flight from baltimore to denver connecting in dallas
atis_flight,2126,list flights between oakland and san francisco
atis_flight,2127,what's the earliest flight leaving denver for pittsburgh
atis_flight,2128,please give me all flights from long beach to memphis
atis_flight,2129,okay i'd like a nonstop flight from houston to memphis that arrives in memphis in the early afternoon on tuesday june first
atis_flight,2130,flights from oakland to san francisco
atis_flight,2131,on september fourth i'll be traveling from pittsburgh to atlanta can you tell me what flight would be the cheapest
atis_flight,2132,find travel arrangements for a round trip flight from dallas to pittsburgh
atis_abbreviation,2133,what does iah mean
atis_flight,2134,the cheapest flights from atlanta to philadelphia that arrive after 12 pm on a tuesday
atis_flight,2135,what is the least expensive flight today from atlanta to san francisco
atis_flight,2136,give me nonstop flights from new york city to las vegas
atis_ground_service,2137,can you rent a car at stapleton international airport in denver
atis_flight,2138,list flights from houston to memphis june twenty ninth
atis_flight,2139,show me flights first class from san francisco to pittsburgh leaving on tuesday after 8 o'clock in the morning and before 12 noon
atis_flight,2140,could you show me all flights from montreal to charlotte
atis_flight,2141,show me the flights from san diego to washington dc
atis_airfare,2142,list all round trip fares from pittsburgh to washington dc
atis_flight,2143,show me flights monday night after 8 pm for dallas to boston
atis_flight,2144,flights from charlotte to baltimore
atis_flight,2145,show me the flights from boston to denver on august second
atis_flight,2146,do you have a flight from boston to fort worth
atis_flight,2147,which united airlines flights go through denver
atis_airfare,2148,i'd like to find the least expensive one way fare from boston to philadelphia
atis_flight,2149,okay does twa have a flight from dallas to san francisco
atis_flight,2150,i'd like a first class flight from denver to baltimore on january first
atis_flight_time,2151,show me times for coach flights between boston and baltimore on wednesday
atis_flight,2152,is there an early morning delta airlines flight between boston and washington
atis_flight,2153,i need a flight on thursday before 8 am from oakland to salt lake city
atis_flight,2154,flights from la guardia or jfk to cleveland
atis_flight,2155,i would like to plan a flight on american airlines from boston to denver
atis_flight,2156,list all flights departing from general mitchell
atis_ground_service,2157,what ground transportation is available in boston
atis_ground_service,2158,tell me about ground transportation in st. petersburg airport
atis_flight,2159,what are connecting flights from chicago to seattle on june first
atis_flight,2160,information of a flight from atlanta to pittsburgh
atis_flight,2161,show me the flights from westchester county to cincinnati
atis_flight,2162,is there a direct flight from atlanta to philadelphia that arrives in philadelphia around 12 noon
atis_flight,2163,i want to fly from baltimore to dallas round trip
atis_airline,2164,of all airlines which airline has the most arrivals in atlanta
atis_flight,2165,show me all flights from boston to denver which arrive in denver wednesday before noon
atis_flight,2166,show me the first class flights from denver to baltimore
atis_airfare,2167,all right what i'd like to do is find the cheapest one way fare from boston to denver
atis_flight,2168,i would like to find a flight from pittsburgh to boston on wednesday and i have to be in boston by one so i'd like a flight out of here no later than 11 am
atis_flight,2169,i'd like to see flights from pittsburgh to atlanta
atis_flight,2170,what are the classes of service for continental airlines
atis_aircraft,2171,list types of aircraft that fly between boston and san francisco
atis_flight,2172,give me the flights from denver to baltimore on united airlines
atis_airfare,2173,what is the cost of a round trip flight from pittsburgh to atlanta beginning on april twenty fifth and returning on may sixth
