intent,Rid,Request
atis_flight,1,i would like to fly the cheapest rate available from pittsburgh to atlanta on wednesday morning
atis_airline,2,show me airlines with flights from pittsburgh to boston please
atis_flight,3,show me the continental flights with meals which depart seattle on sunday for chicago
atis_flight,4,show me flights from denver to dc on wednesday
atis_flight,5,do you have a flight from atlanta to charlotte north carolina next monday
atis_flight,6,what flights are available tuesday afternoon from pittsburgh to atlanta
atis_flight,7,please show me the flights from las vegas to detroit on the twenty eighth
atis_flight,8,can you show me what flights are available on december sixteen going from oakland to dallas
atis_flight,9,i would like to see flights from denver to philadelphia
atis_flight,10,could you please find me the earliest flight from boston to oakland
atis_flight,11,list the cheapest round trip flights from orlando to kansas city
atis_flight,12,is there a thursday night flight from pittsburgh to san francisco on us air
atis_flight,13,i would like an early morning nonstop flight from new york to las vegas on february twenty eighth
atis_airfare,14,july seventh what is the cost of a round trip ticket traveling first class on united airlines leaving from denver going to baltimore
atis_airfare,15,what is the cost of round trip ticket first class between oakland and atlanta
atis_flight,16,i want to go from boston to oakland
atis_airline,17,show me a list of all the airlines that offer business class service
atis_flight,18,what are flights from boston to st. petersburg
atis_flight,19,list daily flights from atlanta to denver
atis_flight,20,show me the flights from cincinnati to denver
atis_flight,21,what flights are there from pittsburgh to los angeles
atis_flight,22,i'd like united airlines flights from denver to baltimore
atis_flight,23,show me all flights from pittsburgh which leave tomorrow and arrive in boston
atis_flight,24,show me flights from milwaukee to orlando on wednesday after 6 pm
atis_flight,25,i would like a flight from denver to pittsburgh
atis_aircraft,26,what type of aircraft is used on the first flight from philadelphia to dallas in the morning
atis_ground_service,27,i need information on ground transportation between airport and downtown in the city of boston
atis_flight,28,flights from phoenix to las vegas
atis_airfare,29,show me the round trip tickets from baltimore to atlanta
atis_flight,30,i'd like to see the flights from pittsburgh to philadelphia
atis_flight,31,my destination is san francisco i live in denver i would like a flight on august thirtieth in the morning on any airline that will get me there
atis_airfare,32,what is the first class fare from indianapolis to orlando
atis_flight,33,show me all the flights to baltimore from denver or philadelphia or pittsburgh
atis_flight,34,are there any flights from new york to montreal canada leaving on thursday
atis_flight,35,show flights from pittsburgh to oakland connecting through denver
atis_abbreviation,36,explain restriction ap 57
atis_abbreviation,37,what does the abbreviation ua mean
atis_quantity,38,how many cities are served by american airline with first class flights
atis_flight,39,what flights are there between nashville and st. louis which are nonstop and arrive after noon and before 8 pm
atis_flight,40,please list the thursday morning flights from st. louis to st. paul
atis_flight,41,what flight leaves dallas for atlanta on august twenty seventh in the evening
atis_flight,42,is there a flight on united airlines from boston to denver
atis_flight,43,does midwest express have any flights
atis_flight,44,show me the flights into love field
atis_flight,45,are there any later flights than 810 pm leaving from milwaukee for tacoma tomorrow evening
atis_flight,46,is there a flight on american airlines going from boston to san francisco on june twenty eighth
atis_abbreviation,47,code ff
atis_flight,48,i want a flight from philadelphia to dallas with a stop in atlanta
atis_flight,49,show me all flights from baltimore or denver or pittsburgh that fly to philadelphia
atis_flight,50,what is the earliest flight on friday from washington to san francisco
atis_airline,51,what airlines from washington dc to columbus
atis_flight,52,flights from denver to seattle on saturday morning on continental
atis_flight,53,what flights go from san francisco to washington via indianapolis
atis_ground_service,54,tell me about the ground transportation in chicago
atis_ground_service,55,i would like to find out the ground travel available in atlanta
atis_flight,56,show me all flights from pittsburgh to dallas
atis_flight,57,show any flights leaving san francisco on sunday and arriving in pittsburgh
atis_airfare,58,how much does flight ua 297 from denver to san francisco cost
atis_flight,59,show me the flights from salt lake city to st. petersburg late night on tuesday
atis_airfare,60,what is the cheapest fare between atlanta and san francisco
atis_flight,61,i need a return flight from chicago to kansas city leaving chicago around 7 in the evening next thursday
atis_quantity,62,how many daily us air flights are there between philadelphia and pittsburgh
atis_flight,63,i need to fly between philadelphia and atlanta
atis_flight,64,what is your last trip from washington to boston on august twenty seventh
atis_flight,65,is there a flight between oakland and boston with a stopover in dallas fort worth on twa
atis_flight,66,show flights from new york city to las vegas
atis_flight,67,show me the flight with the smallest seating capacity which leaves pittsburgh and arrives in baltimore on june fourteenth
atis_flight,68,please show all flights from philadelphia to denver airport next sunday
atis_flight,69,show me all the flights between dallas fort worth and either san francisco or oakland that depart between 5 and 7 pm
atis_flight,70,list flights from philadelphia to san francisco via dallas
atis_flight,71,please list the flights from dallas fort worth to dc baltimore on july twenty third
atis_airfare,72,what's the lowest round trip fare from dallas to atlanta
atis_flight,73,show me the flights from love field
atis_flight,74,flights from cleveland to kansas city on monday
atis_flight,75,i need to fly from baltimore to dallas on tuesday evening
atis_abbreviation,76,what is fare class h
atis_airfare,77,show me the cheapest fare from dallas to baltimore
atis_flight,78,could you tell me if delta flight 296 serves breakfast
atis_flight,79,could i have a list of flights in first class on monday from san francisco to pittsburgh starting at noon and afterwards
atis_flight,80,what flights from miami to indianapolis on sunday
atis_flight,81,does continental airlines fly from denver to san francisco
atis_flight,82,show me one way flights from milwaukee to orlando
atis_flight,83,i would like to see the flights from denver to philadelphia
atis_flight,84,baltimore to philadelphia
atis_flight,85,is there a flight on delta airlines from boston to denver
atis_flight,86,show me all the united flights from boston to denver
atis_flight,87,what are the flights from las vegas to burbank also on saturday may twenty two
atis_flight,88,find a flight between denver and oakland the flight should leave in the afternoon and arrive near 5 pm the flight should also be nonstop
atis_flight,89,what flights go from newark to boston after 1024 in the morning
atis_abbreviation,90,explain the fare code q
atis_flight,91,show me the flights from boston to pittsburgh on wednesday or thursday
atis_flight,92,i'd like to fly nonstop from atlanta to baltimore and get there at 7 pm
atis_flight,93,i'd need information please on a flight from washington dc san francisco california
atis_flight,94,from toronto to atlanta in the afternoon
atis_flight,95,what are the morning flights from boston to philadelphia
atis_flight,96,i need to know if there are any direct flights from st. petersburg florida to tacoma washington leaving preferably tomorrow morning
atis_flight,97,what is the earliest flight going from san francisco to dallas on monday august nineteenth
atis_flight,98,what flights are there from atlanta to washington early on thursday mornings
atis_aircraft,99,what aircraft is used on delta flight 1222 from kansas city to salt lake city
atis_abbreviation,100,what does dfw mean
atis_airfare,101,what's the cheapest round trip fare between boston and washington
atis_flight,102,please list all delta flights from kansas city to salt lake city
atis_flight,103,find me the earliest flight from boston to atlanta on any day of the week
atis_airfare,104,what's the lowest round trip fare from dallas to any city
atis_flight,105,hi i'd like to fly from columbus to phoenix and make a stop in cincinnati along the way
atis_airfare,106,how much does it cost to fly on delta from dallas to baltimore
atis_flight,107,show me all flights from denver to baltimore
atis_flight,108,what flights land at general mitchell international
atis_flight,109,i'm sorry i want to book a flight from atlanta to denver colorado
atis_flight,110,flight from denver to salt lake city
atis_airfare,111,what is the lowest cost fare that delta has between boston and san francisco
atis_flight,112,i'd like to take a flight from washington dc stop in denver and with my final destination as san francisco
atis_flight,113,on november twenty third of this year 1991 i'd like to fly from atlanta to denver and i'd like to fly on delta
atis_flight,114,what is the earliest flight leaving denver and arriving in baltimore on united airlines first class on july fourth
atis_ground_service,115,show ground transportation for pittsburgh
atis_flight,116,list lowest cost flight from dallas to baltimore that serves a meal
atis_flight,117,flights from dallas to houston in the morning
atis_flight,118,show me flights from dallas to san francisco on wednesdays
atis_flight,119,flight information from pittsburgh to denver
atis_flight,120,friday's flights between newark and tampa
atis_flight,121,give me a flight from memphis to las vegas and new york city to las vegas on sunday that arrive at the same time
atis_flight,122,i would like a flight from philadelphia to san francisco
atis_flight,123,flights from ontario to florida
atis_flight,124,i'd like to arrange a flight from pittsburgh to atlanta
atis_airfare,125,how much does it cost to fly directly from philadelphia to san francisco on american airlines
atis_ground_service,126,show me ground transportation in boston
atis_flight,127,does american airlines fly from philadelphia to dallas
atis_flight,128,show me the flights from denver to atlanta
atis_flight,129,what are the flights from pittsburgh to baltimore
atis_abbreviation,130,what is dl
atis_flight,131,a first class flight on american to san francisco on the coming tuesday
atis_flight,132,what flights go from newark to boston after 5 pm
atis_abbreviation,133,what is restriction ap 57
atis_flight,134,list all the flights that takeoff from general mitchell international
atis_airline,135,what airlines are ac and as
atis_flight,136,i want a return flight from washington to dallas on american airlines
atis_ground_service,137,what ground transportation is available at baltimore
atis_flight,138,list all flights from denver to philadelphia
atis_flight,139,give me the flights from memphis tennessee to charlotte north carolina
atis_flight,140,i need a nonstop flight from san diego to phoenix
atis_flight,141,on eastern flight 825 from atlanta to denver can you tell me what type of aircraft used before 12 noon
atis_flight,142,list the cheapest one way flight from miami florida to charlotte north carolina
atis_flight,143,i want the cheapest flight from pittsburgh to atlanta
atis_flight,144,what's the earliest flight from pittsburgh to baltimore on thursday morning
atis_flight,145,are there any flights from philadelphia to dallas which stop in atlanta
atis_flight,146,list all takeoffs and landings at general mitchell international
atis_flight,147,when is the first flight in the morning from boston to denver
atis_flight,148,show me the flights from san francisco to boston
atis_flight,149,what are the evening flights flying out of dallas and going to san francisco on american airlines
atis_flight,150,show me the flights from baltimore to philadelphia
atis_flight,151,show me the flights from philadelphia to dallas with one stop
atis_airfare,152,show me the cheapest one way fares from san diego to miami
atis_flight,153,show all flights from miami to jfk
atis_ground_service,154,tell me about ground transportation at san francisco
atis_flight,155,show me flights from philadelphia to oakland on friday
atis_flight,156,i want to make a trip from washington to san francisco
atis_flight,157,tell me the flights from dallas to baltimore
atis_flight,158,flying from pittsburgh to philadelphia on us air
atis_flight,159,what flights are there from milwaukee to phoenix on saturday
atis_aircraft,160,what's the next smallest plane after a turboprop
atis_flight,161,what is the first flight arriving in montreal from toronto friday
atis_aircraft,162,sure i'd like to determine what aircraft are use on july seventh leaving from boston and arriving in atlanta on july seventh
atis_flight,163,can you tell me about flights from san jose to nashville on saturday afternoon
atis_flight,164,morning flight from dallas to atlanta
atis_airline,165,which airlines fly between baltimore and san francisco
atis_flight,166,i'm flying from boston to dallas
atis_flight,167,show me flights from san francisco to seattle
atis_airfare,168,please find the cheapest fare from boston to san francisco
atis_flight,169,let's look at baltimore to philadelphia again
atis_flight,170,show me first class flights from pittsburgh to san francisco on friday
atis_ground_service,171,what transportation is available from the dallas airport to downtown
atis_flight,172,list all flights leaving denver on continental on sunday after 934 pm
atis_flight,173,i would like a flight between boston and atlanta on any day at one in the afternoon
atis_flight,174,is there a 4 o'clock flight from washington dc to denver
atis_abbreviation,175,what is as
atis_flight,176,first flights from pittsburgh to atlanta on a thursday
atis_flight,177,i would like a list of flights from pittsburgh to dallas
atis_flight,178,show me the flights from san francisco to newark that leave after 11 pm
atis_flight,179,what flights are available wednesday morning from boston to denver
atis_flight,180,flights from new york to miami
atis_flight,181,i would like a flight from boston to san francisco on august seventeenth
atis_airfare,182,show me the most expensive one way first class fare from baltimore to dallas
atis_flight,183,what afternoon flights are available between denver and dallas fort worth
atis_flight,184,information on american airlines flight from washington to philadelphia
atis_flight,185,show me flights from denver to washington dc on wednesdays
atis_flight,186,show all flights from denver to san francisco
atis_flight,187,what flights leave from phoenix
atis_flight,188,show me all the flights from denver to baltimore arriving may tenth
atis_flight,189,what are the flights from cleveland to indianapolis for wednesday the twelfth
atis_abbreviation,190,what does the fare code f mean
atis_ground_service,191,is there ground transportation from the pittsburgh airport to downtown pittsburgh
atis_flight,192,show me flights from boston to baltimore coach on wednesday about 12 noon
atis_flight,193,what is the earliest arrival in salt lake city of a flight from toronto
atis_flight,194,flights from atlanta august second
atis_ground_service,195,what kind of ground transportation is available in denver
atis_ground_service,196,what type of ground transportation is available between the airport and downtown san francisco
atis_flight,197,all flights from miami to new york
atis_flight,198,list all tuesday night flights from boston to denver
atis_flight,199,find travel arrangements for a round trip flight from dallas to pittsburgh
atis_ground_service,200,show me a list of ground transportation at denver
atis_flight,201,i'd like to fly united airlines from washington to denver
atis_flight,202,does us air fly from dc to dallas
atis_flight,203,i would like an american flight from toronto to san diego with a stopover in denver please
atis_flight,204,show me the economy flights from baltimore to dallas
atis_flight,205,on november twenty third what flights go from atlanta to denver on delta airlines
atis_flight,206,hello i'd like a delta flight from atlanta to boston
atis_flight,207,please give me the flights from boston to pittsburgh on thursday of next week
atis_flight,208,please give me flights from atlanta to boston on wednesday afternoon and thursday morning
atis_flight,209,i want to travel from pittsburgh to oakland around midnight could you give me the flights
atis_aircraft,210,i need to find a plane from boston to san francisco on friday
atis_flight,211,what is the first flight that travels from atlanta to baltimore that serves lunch
atis_flight,212,what flights are there between washington dc and san francisco after 6 pm on wednesday
atis_flight,213,morning flights from pittsburgh to atlanta on wednesday
atis_flight,214,what flights are available from pittsburgh to boston on wednesday of next week
atis_flight,215,i would like a flight from atlanta to denver
atis_flight,216,i need a flight from long beach to st. louis stopping in dallas the flight should also serve lunch
atis_flight,217,show me flights between new york city and las vegas on sunday
atis_flight,218,looking for a flight from dc to minnesota
atis_flight,219,i need a flight from st. petersburg to miami for thursday
atis_flight,220,show me the evening flights from philadelphia to atlanta
atis_flight,221,i would like information on flights leaving atlanta in the afternoon arriving in dallas
atis_flight,222,now i need a flight on tuesday from phoenix to detroit
atis_flight_time,223,show me times for flights from san francisco to atlanta
atis_flight,224,i need a flight leaving pittsburgh next monday arriving in fort worth before 10 am
atis_flight,225,what are the flights from nashville to tacoma on tuesday the eighteenth of may
atis_flight,226,flights from newark new jersey to cleveland ohio
atis_ground_service,227,i need your help with information on ground transportation from the airport in philadelphia to downtown
atis_flight,228,do you have any flights from chicago to indianapolis
atis_flight,229,please list all flights on united airlines out of denver before noon
atis_flight,230,list the flights from dallas to baltimore
atis_flight,231,give me the flights from washington dc to philadelphia for december second
atis_flight,232,what are the round trip flights from philadelphia to san francisco
atis_flight,233,find a flight between denver and oakland the flight should be in the afternoon and arrive close to 5 pm the flight should be nonstop
atis_flight,234,flights from la guardia to jfk
atis_flight,235,please list all the arriving and departing flights from general mitchell international
atis_airline,236,what airline stands for hp
atis_flight,237,what flights from washington to toronto
atis_flight,238,what flights from washington dc to toronto
atis_flight,239,please list the monday morning flights from kansas city to atlanta
atis_flight,240,show me all the flights on delta airlines and twa that go to atlanta in the morning
atis_flight,241,flights from atlanta to dallas in the afternoon
atis_flight,242,cheapest flight from memphis to miami
atis_flight,243,show me flights from denver to san francisco on wednesday
atis_flight,244,what flights does delta have from denver to dallas after 5
atis_ground_service,245,please give ground transportation at denver airport
atis_flight,246,what flights go from pittsburgh to denver after 2 pm
atis_flight,247,what flights are available from pittsburgh to baltimore on july twenty fifth 1991
atis_flight,248,i need a flight from boston to san francisco leaving in the afternoon and arriving in the evening thank you
atis_flight,249,flights between tampa and st. louis
atis_flight,250,which flights depart los angeles destination charlotte that leave on a monday morning
atis_flight,251,for each airline flying between boston and san francisco what is the earliest flight
atis_flight,252,i would like a flight from washington to boston on august twentieth at 324 pm
atis_flight,253,show morning flights from philadelphia to dallas
atis_flight,254,list all round trip flights from indianapolis to orlando departing either on december twenty seventh or on december twenty eighth
atis_flight,255,i want a flight from houston to memphis on tuesday morning
atis_flight,256,show me cheap flights from baltimore to dallas
atis_airfare,257,lowest fare from san francisco to orlando
atis_flight,258,is there a flight from charlotte to newark on tuesday evening
atis_flight,259,show me all the delta flights leaving pittsburgh between 12 and 4 in the afternoon
atis_flight,260,list all flights from minneapolis to long beach on saturday
atis_flight,261,flights from montreal
atis_flight,262,does midwest express serve charlotte
atis_flight,263,what flights are available wednesday afternoon from denver to san francisco
atis_flight,264,what flights depart from pittsburgh and arrive in oakland california
atis_flight,265,show me the flights from tacoma to miami after 6 pm
atis_flight,266,what flights are there from milwaukee to phoenix on saturday
atis_flight,267,is there a flight on continental airlines from boston to denver
atis_quantity,268,how many united flights are there to san francisco
atis_flight,269,give me a flight from baltimore to newark that arrives as early as possible
atis_flight,270,what flights leave from newark to los angeles in the afternoon
atis_airfare,271,round trip fares from denver to philadelphia less than 1000 dollars
atis_flight,272,i want to leave from philadelphia and go to atlanta baltimore and boston please list these flights
atis_flight,273,find me the earliest flight from boston to atlanta and the latest return to boston on the same day
atis_flight,274,list the delta airlines flights from boston to philadelphia
atis_flight,275,what is the least expensive flight from pittsburgh to atlanta leaving on october fifth
atis_airfare,276,how much does flight dl 402 from denver to philadelphia cost
atis_flight,277,give me the cheapest one way flights between boston and philadelphia which arrive after noon on a tuesday
atis_ground_service,278,list ground transportation in detroit
atis_quantity,279,how many united flights are there from san francisco please
atis_flight,280,on april sixth i would like to book an early morning flight from tampa to charlotte
atis_ground_service,281,what type of ground transportation is available at logan airport
atis_flight,282,a breakfast flight from denver to san francisco please
atis_flight,283,i need a flight from atlanta to baltimore nonstop arriving at 7 pm please
atis_flight,284,flights between new york and miami
atis_flight,285,give me a flight from philadelphia to denver on sunday
atis_airfare,286,round trip fares from baltimore to philadelphia under 1000 dollars
atis_flight,287,i need to go from boston to denver and then to san francisco
atis_flight,288,do you have a flight from atlanta to baltimore nonstop on a boeing 757 arriving baltimore around 7 pm
atis_flight,289,show me the flights from dallas to baltimore at economy level
atis_flight,290,show me all flights from san francisco to boston philadelphia or baltimore
atis_flight,291,is there a flight in the afternoon from philadelphia that arrives in the evening in denver
atis_flight,292,show me all flights from denver to san francisco
atis_quantity,293,how many flights does american airlines have with a class of service code f
atis_flight,294,show me the flights from baltimore to seattle
atis_flight,295,what is the cheapest round trip flight from atlanta to pittsburgh
atis_flight,296,show me flights arriving in baltimore from pittsburgh between 4 and 5 pm
atis_airfare,297,what is the first class fare on united flight 352 from denver to boston
atis_flight,298,what flights are available from boston to denver on wednesday in early morning
atis_flight,299,what is the cheapest flight from boston to bwi
atis_airfare,300,what is the thrift economy flight fare from washington to san francisco
atis_airfare,301,what would be cost of a round trip from pittsburgh to san francisco
atis_flight,302,flight from dallas to milwaukee
atis_flight,303,i want a flight from denver to pittsburgh then from pittsburgh to atlanta then from atlanta back to pittsburgh back to denver
atis_flight,304,what flights from kansas city to chicago arrive at chicago at 7 pm next wednesday
atis_airfare,305,what is the cost of a round trip ticket flying from boston to dallas dallas to oakland leaving july first
atis_flight,306,are there any flights from boston to san francisco which stop in washington dc
atis_aircraft,307,what kind of airplane is flight ua 270 from denver to philadelphia
atis_flight,308,list the flights arriving in atlanta from boston between 4 and 8 pm
atis_flight,309,i'd like to fly round trip from boston to pittsburgh
atis_airfare,310,what is the fare going from atlanta to boston one way on november seventh
atis_airfare,311,please give me round trip fares from baltimore to philadelphia
atis_ground_service,312,information on ground transportation from airport to downtown boston
atis_flight,313,do you have any flights from denver to baltimore via dallas
