intent,Rid,Request
atis_flight,941,what flights are available between boston and washington arriving in washington at 630
atis_flight,942,what flights are between washington and san francisco
atis_flight,943,what are the morning flights from philadelphia to dallas going on american airlines
atis_flight,944,what's the cheapest one way flight from oakland to washington dc
atis_flight,945,list all flights on continental leaving denver on monday
atis_flight,946,what is the latest flight in the day to arrive in boston from baltimore
atis_flight,947,denver to atlanta
atis_airline,948,which airlines have flights from san francisco to washington by way of indianapolis
atis_airfare,949,what is the cheapest round trip fare from atlanta to pittsburgh
atis_flight,950,i need information on a flight from boston to denver
atis_flight,951,show me the flights on twa to atlanta in the morning
atis_flight,952,please give me all the flights from long beach california to memphis tennessee
atis_flight,953,i need to fly from washington to san francisco but i'd like to stop over at dallas can you tell me a schedule of flights that will do that
atis_flight,954,does american airlines fly from boston to san francisco
atis_flight,955,delta flights to san francisco please
atis_flight,956,on may four atlanta to denver delta flight 257
atis_flight,957,what flights are there on sunday from seattle to minneapolis
atis_flight,958,show me all the flights from milwaukee to orlando that leave after noon on wednesday and before noon on thursday
atis_airfare,959,what are the prices of these flights
atis_flight,960,i'm interested in round trip flights from boston to washington
atis_flight,961,list the flights on friday afternoon from philadelphia to oakland
atis_flight,962,show me the flights from st. petersburg to toronto that leave monday
atis_aircraft,963,what's the smallest plane flying from pittsburgh to baltimore on december seventeenth
atis_airfare,964,show me the most expensive fare
atis_flight,965,which flights leaving baltimore to dallas on monday afternoon have economic class
atis_abbreviation,966,what is the ap 57 restriction
atis_airfare,967,cheapest airfare from tacoma to orlando
atis_abbreviation,968,what does fare code qo mean
atis_ground_service,969,ground transport denver
atis_flight,970,are there any turboprop flights from pittsburgh to baltimore on december seventeenth
atis_flight,971,what is the last flight from boston to atlanta
atis_flight,972,flights from cincinnati to o'hare departing after 718 am american
atis_flight,973,show me all flights from philadelphia to denver on sunday which leave philadelphia after noon
atis_flight,974,flights from cincinnati to denver on american airlines
atis_airline,975,show me the airlines that fly from toronto to boston
atis_flight,976,show me all flights from atlanta to washington with prices
atis_airline,977,please show me airlines with service from boston to denver
atis_airfare,978,show me fares from houston to las vegas
atis_abbreviation,979,what does ea mean
atis_flight,980,i want a direct flight from oakland to boston that leaves on a wednesday
atis_airfare,981,what is the cost of a first class ticket from baltimore to dallas
atis_flight,982,show me flights from denver to atlanta on june sixteenth
atis_flight,983,i would like some information on flights leaving boston to atlanta
atis_flight,984,i'd like the earliest flight information from boston to san francisco with a meal
atis_abbreviation,985,what is sa
atis_ground_service,986,what kinds of ground transportation is available in dallas fort worth
atis_flight,987,yes on the delta flight leaving san francisco at 225 pm arriving philadelphia 1158 pm what type of equipment is used on that flight
atis_flight,988,are there any flights on us air from pittsburgh to atlanta on wednesday
atis_flight,989,show me all flights which leave pittsburgh tomorrow and arrive in baltimore after 5 o'clock pm
atis_flight,990,what are the flights from milwaukee to orlando on wednesday night
atis_ground_service,991,what car rentals are available next sunday from denver airport
atis_flight,992,okay for now i would like information on a flight on april twenty seventh from pittsburgh to atlanta leaving early in the morning about 8 o'clock
atis_flight,993,show flights from pittsburgh into san francisco
atis_flight,994,what flights are currently available between boston and dallas fort worth
atis_flight,995,flights from atlanta to washington dc
atis_flight,996,list all flights going from boston to atlanta after 6 o'clock pm on wednesday
atis_quantity,997,how many of delta's night flights are first class
atis_airfare,998,what is the economy thrift fare from boston to washington
atis_flight,999,very well i'm working on scenario three i'm interested in a flight on a 727 from washington dc to atlanta georgia
atis_ground_service,1000,i need ground transportation in dallas please show me what's available
atis_flight,1001,does midwest express have any flights from montreal to detroit
atis_flight,1002,what classes of service does twa have
atis_flight,1003,show me flights from miami to new york leaving on a sunday first class
atis_airline,1004,what airline is ea
atis_airfare,1005,what is the cheapest round trip fare from pittsburgh to atlanta
atis_flight,1006,what is the earliest american airlines flight that i can get first class from philadelphia to dallas
atis_flight,1007,find me the earliest flight from boston to atlanta
atis_flight,1008,show me the flights from boston to denver
atis_flight,1009,please give me flights leaving san francisco and going to pittsburgh
atis_abbreviation,1010,what does ua stand for
atis_abbreviation,1011,what's the difference between fare code q and fare code f
atis_flight,1012,i want to fly from miami to chicago on american airlines and arrive at around 5 o'clock in the afternoon show me all flights
atis_flight,1013,i would like to see all flights from baltimore to philadelphia
atis_flight,1014,flights from baltimore to philadelphia please
atis_flight,1015,list flights from san francisco to pittsburgh
atis_flight,1016,show me delta flights from dallas to denver
atis_flight,1017,show me all the flights from new york to milwaukee
atis_flight,1018,okay and then from pittsburgh i'd like to travel to atlanta on september fourth
atis_aircraft,1019,i'm traveling from boston to atlanta and i'd like to go sometime after 5 pm but i want to know what kind of airplane it's on
atis_flight,1020,what flights leave seattle on sunday on continental after 9 pm
atis_flight,1021,all round trip flights between new york and miami business class fare
atis_flight,1022,show flights from denver into san francisco
atis_flight,1023,can you tell me the afternoon nonstop flights departing from atlanta to boston
atis_flight,1024,list all flights please from washington to san francisco
atis_flight,1025,please list the flights from kansas city to denver
atis_flight,1026,list all the flights from atlanta to philadelphia on august the first
atis_airfare,1027,what is the fare on november seventh going one way from dallas to san francisco
atis_flight,1028,please list pm flights from boston pittsburgh
atis_flight,1029,what are the nonstop flights from kansas city to burbank arriving on saturday may twenty two
atis_flight,1030,what is the earliest flight on thursday from atlanta to washington dc
atis_flight,1031,what are the flights from denver to oakland
atis_ground_service,1032,what kind of ground transportation is there in philadelphia
atis_abbreviation,1033,what does ls stand for
atis_flight,1034,what flights are there between atlanta and denver
atis_flight,1035,i would like to travel from indianapolis to houston
atis_flight,1036,give me a flight between boston and denver
atis_airline,1037,please show me airlines with flights from denver to boston with a stopover in philadelphia
atis_flight,1038,are there any flights from boston to oakland that stop
atis_airfare,1039,find me the cheapest one way fare i can get from boston to denver
atis_flight,1040,list daily flights from oakland to boston using continental airlines
atis_flight,1041,on monday show me flights from baltimore to dallas
atis_ground_service,1042,can you help me with ground transportation information i need to get from the airport in philadelphia to downtown philadelphia
atis_flight,1043,are there any flights from milwaukee to tacoma on friday june eleventh
atis_flight,1044,what is the latest flight from san francisco to boston
atis_flight,1045,show me all flights from san francisco to washington dc
atis_flight,1046,may i see all nonstop flights from st. petersburg to charlotte
atis_flight,1047,i would like to travel from washington dc to pittsburgh on august twentieth
atis_flight,1048,also give me a list of flights between oakland and boston
atis_flight,1049,i want the flights from denver to pittsburgh
atis_flight,1050,what are the flights from indianapolis to san diego on wednesday the twelfth
atis_flight,1051,what's the earliest flight from san francisco to boston
atis_flight,1052,are there any flights from denver to atlanta which connect in pittsburgh
atis_flight,1053,i would like an early flight from la to charlotte monday morning
atis_flight,1054,show me all flights from baltimore to san francisco
atis_flight,1055,on july twenty third all flights on american airlines from philadelphia to san francisco
atis_flight,1056,show me the flights from love field
atis_airfare,1057,what do these cost
atis_flight,1058,show me all the flights from burbank
atis_flight,1059,please find a flight on delta from philadelphia to san francisco and give me the flight numbers
atis_flight,1060,i'd like flights on american from philadelphia to dallas arriving before 1145 am
atis_airfare,1061,what is the cheapest first class fare from cleveland to miami on us air on february twenty fourth
atis_flight,1062,what flights are there from charlotte to baltimore
atis_flight,1063,does american airlines fly from philadelphia to san francisco
atis_flight,1064,which flights are there on tuesday from san francisco to pittsburgh
atis_flight,1065,what are all flights from san francisco to philadelphia with stops in pittsburgh
atis_airfare,1066,what is the cost for these flights from baltimore to philadelphia
atis_flight,1067,i'd like to get a flight from washington to oakland with a stopover in dallas fort worth for september fifteenth
atis_flight,1068,show me all us air flights from atlanta to denver for the day after tomorrow
atis_abbreviation,1069,does dl stand for delta
atis_quantity,1070,how many flights does continental airlines have with a class of service code f
atis_flight,1071,i would like information on twa flights from washington to philadelphia
atis_flight,1072,i would like a flight as early as possible in the day leaving from boston and to denver
atis_flight,1073,show me the flights from pittsburgh to san francisco on friday
atis_flight,1074,i want a flight from san diego to indianapolis that leaves tuesday afternoon
atis_flight,1075,flights from memphis to las vegas on sunday
atis_quantity,1076,list the number of flights leaving boston for dallas fort worth before 9 am in the morning
atis_airfare,1077,what are the round trip fares for flights from denver to philadelphia arriving after 1700 on continental
atis_flight,1078,now i need a one way flight from pittsburgh to denver
atis_flight,1079,what flights are available friday from san francisco to boston
atis_aircraft,1080,i would like a to know the type of aircraft leaving from atlanta bound to boston on friday this week
atis_flight,1081,i'd like to know the shortest trip between boston and san francisco
atis_abbreviation,1082,what is the abbreviation for canadian airlines international
atis_flight,1083,show me the nonstop flights from houston to dallas
atis_flight,1084,information on flights from atlanta to washington dc departing on thursday before 9 am
atis_flight,1085,are there any flights from denver to atlanta to pittsburgh
atis_airfare,1086,i would like to see the economy fares for denver to philadelphia
atis_flight,1087,show me all nonstop flights from salt lake city to cincinnati
atis_flight,1088,please list the flights from charlotte to long beach arriving after lunch time
atis_flight,1089,show me the flights from philadelphia to boston
atis_flight,1090,can you tell me what flights you have from baltimore to dallas
atis_flight,1091,i'd like to fly from minneapolis to long beach two days from today in the early morning
atis_airfare,1092,can you show me the price of a flight to washington from atlanta on thursday morning
atis_flight,1093,all round trip flights between new york and miami coach fare
atis_flight,1094,what is the last flight from san francisco to dallas fort worth
atis_flight,1095,show me the flights from philadelphia to atlanta
atis_flight,1096,what are the flights from denver to san francisco on tuesday october fifteenth
atis_flight,1097,denver to philadelphia monday
atis_flight,1098,show flights first class on american airlines between dallas and philadelphia
atis_flight,1099,do you have a flight from salt lake city to st. petersburg on june second
atis_flight,1100,what flights are available tomorrow from denver to philadelphia
atis_flight,1101,what flights are available thursday afternoon from baltimore to atlanta
atis_flight,1102,is there a flight from atlanta to san francisco that stops over in denver
atis_flight,1103,i want to fly philadelphia to dallas on july eighth
atis_flight,1104,pittsburgh to denver
atis_flight,1105,please give me a flight from boston to atlanta before 10 am in the morning
atis_airfare,1106,please show me all fares for flights from denver to oakland
atis_flight,1107,what flights are there from houston to dallas
atis_flight,1108,what's the earliest flight from san jose to houston
atis_flight,1109,on november twenty third what flights are available between boston and denver
atis_flight,1110,i also need to go to san francisco on wednesday evening from dallas
atis_flight,1111,i'd like the flights from san jose to nashville on the morning of friday june third
atis_airfare,1112,show me all first class fares from new york to miami leaving on a tuesday
atis_flight,1113,i would like information on flights from denver to san francisco after noon on wednesday
atis_flight,1114,dallas to oakland monday
atis_flight,1115,show me all flights from san diego to dulles on boeing 767
atis_flight,1116,i would like to find a flight that goes from la guardia airport to san jose i would like the flight to be on united airlines and arrive in san jose around 10 pm
atis_flight,1117,i'd like to fly from san francisco to boston with a stopover in dallas fort worth and i want to fly on delta airlines
atis_ground_service,1118,what is the ground transportation available in denver
atis_flight,1119,i'd like to go from boston to san francisco with a stop in dallas
atis_flight,1120,flights from atlanta please
atis_flight,1121,i want a flight on twa from boston to san francisco
atis_flight,1122,give me the flights from pittsburgh to los angeles on thursday evening
atis_flight,1123,can you show me flights from baltimore to dallas
atis_flight,1124,show me flights from pittsburgh to philadelphia
atis_flight,1125,show all flights from boston to denver on july thirty first
atis_airfare,1126,how much does it cost to fly one way from boston to washington first class
atis_flight,1127,what stops does dl 838 make from san francisco to atlanta
atis_flight,1128,phoenix to newark wednesday
atis_flight,1129,show me all flights from boston to pittsburgh on wednesday of next week which leave boston after 2 o'clock pm
atis_flight,1130,looking for a flight from denver to salt lake city
atis_flight,1131,i would like information on a flight between washington and san francisco with a stopover in dallas
atis_flight,1132,can you list all flights leaving from st. louis and arriving in milwaukee
atis_flight,1133,is there one stop with the us air boston leaving at 705 to atlanta
atis_flight,1134,nonstop or connecting flights from seattle to boston
atis_flight,1135,from denver to baltimore
atis_flight,1136,please show me flights from dallas fort worth to atlanta on monday
atis_flight,1137,what's the cheapest flight from dallas to baltimore on december seventeenth
atis_flight,1138,show me the latest dinner flight from baltimore to oakland
atis_flight,1139,on august thirtieth i would like a flight from denver to san francisco in the early am
atis_flight,1140,i would like a flight from atlanta to dallas on friday that arrives in dallas by 6 pm
atis_flight,1141,leave flight from boston to atlanta leave boston approximately 1 pm
atis_flight,1142,on tuesday the twenty third flights from philadelphia to san francisco on american airlines
atis_flight,1143,i need a flight from montreal quebec to san diego california leaving this sunday
atis_flight,1144,show me flights from philadelphia to baltimore
atis_flight,1145,what northwest airline flights leave denver before noon
atis_flight,1146,show me the least expensive flight leaving miami on sunday after 12 o'clock noon and arriving cleveland
atis_flight,1147,could i have a listing of flights leaving boston going to baltimore leaving wednesday after 2100
atis_flight,1148,show me the earliest flight on august second from boston to denver that serves a meal
atis_airfare,1149,what is the cost of united airlines flight 415 from chicago to kansas city thursday night
atis_flight,1150,list all flights from boston to san francisco with more than 3 stops
atis_flight,1151,show me all direct flights from dallas fort worth to either san francisco or oakland
atis_flight,1152,i want to go from denver to oakland
atis_flight,1153,is there a flight from boston to atlanta which leaves boston in the afternoon and arrives close to 5 pm
atis_flight,1154,from baltimore to san francisco
atis_ground_service,1155,is there ground transportation from the airport to downtown phoenix
atis_flight,1156,what are all flights from boston to pittsburgh on wednesdays
atis_flight,1157,show me the flights from baltimore to philadelphia
atis_flight,1158,show me flights from denver to philadelphia on a monday
atis_flight,1159,is there a flight between oakland and boston with a stopover in dallas fort worth on twa
atis_flight,1160,show me the flights from denver to philadelphia again
atis_flight,1161,show me all flights from san francisco to pittsburgh
atis_flight,1162,show me the flights from baltimore to boston
atis_abbreviation,1163,what does restriction ap 57 mean
atis_flight,1164,i would like a nonstop flight from jfk to las vegas on march second
atis_airfare,1165,show me fares from miami to new york
atis_flight,1166,i need to know what flights leave atlanta on sunday evening and arrive in baltimore
atis_flight,1167,i would like to know the latest flight on wednesday you have leaving from oakland to salt lake city which offers a meal
atis_flight,1168,what first class flights are available on july twenty fifth 1991 from denver to baltimore
atis_ground_service,1169,could you tell me about ground transportation arrangements from the dallas airport to downtown dallas
atis_flight,1170,give me all nonstops from new york city to las vegas that arrive on a sunday
atis_airline,1171,which airlines have daily flights from boston to dallas
atis_flight,1172,nonstop flights denver to kansas city
atis_flight,1173,i would like information information on flights from san francisco to denver on thursday morning
atis_flight,1174,now i'd like to see flights from detroit to st. petersburg on the next tuesday
atis_flight,1175,show me the cheapest one way flight from atlanta to pittsburgh
atis_flight,1176,show me flights from pittsburgh to atlanta on monday morning
atis_flight,1177,an early flight on wednesday morning from baltimore to newark
atis_flight,1178,which flights arrive in st. louis from st. paul on thursday morning
atis_flight,1179,list nonstop flights from houston to dallas which arrive after 8 pm
atis_flight,1180,can you list all flights from washington to toronto
atis_abbreviation,1181,what does us mean
atis_flight,1182,flight from boston to baltimore
atis_flight,1183,i'd like to find a flight from tampa to montreal that makes a stop in new york
atis_flight,1184,what is the cheapest flight from pittsburgh to atlanta
atis_flight,1185,i need to fly from dallas to san francisco and be in san francisco by 4 pm
atis_flight,1186,please list all flights between indianapolis and orlando on the twenty seventh of december
atis_flight,1187,show me morning flights from atlanta to philadelphia
atis_flight,1188,i want a flight on saturday from minneapolis to long beach
atis_quantity,1189,how many first class flights does united have leaving from all cities today
atis_airfare,1190,what is the least expensive one way fare from boston to san francisco
atis_flight,1191,show me the flights from baltimore to boston
atis_quantity,1192,how many flights does delta have with a class of service code f
atis_flight,1193,san francisco to philadelphia please
atis_flight,1194,i need a flight from san francisco to pittsburgh and then pittsburgh to new york and new york to san francisco
atis_flight,1195,i would like to know the flights that are available leaving out of pittsburgh to san francisco on thursday night after 9 pm
atis_flight,1196,please find the earliest possible flight from boston to denver
atis_flight,1197,show me flights from new york to miami on a tuesday with a round trip fare less than 466 dollars
atis_flight,1198,find me the latest flight leaving atlanta august seventh and arriving in denver
atis_flight,1199,on tuesday what flights leave phoenix to st. paul minnesota and leave after noon
atis_abbreviation,1200,what does mco mean
atis_flight,1201,what is the least expensive flight available from dallas fort worth to san francisco
atis_flight,1202,show me the flights from dallas to atlanta
atis_flight,1203,i would like information on flights leaving early monday morning from atlanta to baltimore
atis_flight,1204,please list all flights from atlanta to baltimore on wednesday and thursday
atis_flight,1205,what is your cheapest flight from pittsburgh to denver
atis_flight,1206,show me the flights from boston to pittsburgh on thursday
atis_flight,1207,please list the flights from ontario california to orlando florida
atis_flight,1208,flights from pittsburgh to baltimore arriving between 4 and 5 pm
atis_flight,1209,show me all flights arriving at dallas
atis_flight,1210,list daily flights from oakland to boston using delta airlines
atis_abbreviation,1211,what is restriction ap 57
atis_flight,1212,show me flights between milwaukee and phoenix on saturday or sunday american airlines
atis_flight,1213,what are all flights from pittsburgh to boston on wednesdays
atis_flight,1214,i'd like to fly from denver to atlanta with a stop in pittsburgh
atis_flight,1215,the cheapest flights between boston and philadelphia which arrive between 3 and 5 o'clock on tuesday
atis_airfare,1216,what is the fare going from baltimore to atlanta one way on november seventh
atis_abbreviation,1217,what is restriction ap57
atis_flight,1218,all northwest flights with stopovers in denver
atis_flight,1219,interested in a flight from washington to fort worth
atis_flight,1220,show flights from pittsburgh into san francisco
atis_ground_service,1221,what is the ground transportation available in boston
atis_airfare,1222,give me fares from atlanta to baltimore
atis_ground_service,1223,is there ground transportation between airport and downtown in boston
atis_airfare,1224,how much is the cheapest flight from denver to pittsburgh with a stop in atlanta
atis_flight,1225,all flights pittsburgh to baltimore on thursday arrival by 10 am
atis_flight,1226,list united flights from denver to san francisco on wednesdays
atis_flight,1227,what flights are there from dallas to pittsburgh on monday morning
atis_flight,1228,what flights do you have from milwaukee to tampa
atis_flight,1229,all flights from boston to washington dc on the tenth of november
atis_airfare,1230,i need one first class ticket from dallas fort worth to san francisco
atis_flight,1231,what is the earliest flight from boston to washington
atis_flight,1232,flights on sunday from tampa to charlotte
atis_airfare,1233,i'd like to buy a coach class ticket for a flight from denver to atlanta
atis_flight,1234,show me flights from new york to miami
atis_flight,1235,what flights are available from boston to denver
atis_flight,1236,find me the earliest flight from boston to denver that serves breakfast
atis_flight,1237,show me all flights arriving at love field from other airports
atis_airline,1238,what airlines have business class service between boston and san francisco
atis_abbreviation,1239,what is fare code f
atis_ground_service,1240,can i see ground transportation from long beach airport to downtown
atis_flight,1241,which flights on united airlines and northwest go through denver
atis_flight,1242,what flights are there tomorrow from tacoma to san jose
atis_flight,1243,show the flights from milwaukee to orlando on a thursday morning
atis_airline,1244,show me the airlines between boston and toronto
atis_airline,1245,which airlines go from san francisco to washington by way of indianapolis
atis_flight,1246,what are the flights from baltimore to dallas on sunday afternoon
atis_flight,1247,may i have a listing of flights from minneapolis to long beach california on tuesday
atis_quantity,1248,how many nonstop flights going from dallas to oakland july twenty seventh
